13:45:46.904915 IP 10.202.217.55.56235 > 192.168.7.1.80: tcp 0
E..@YS@.@.5.
..7.......P...........................
BV
.........
13:45:48.752414 IP 10.202.217.55.56235 > 192.168.7.1.80: tcp 0
E..4o.@.@..q
..7.......P...................
BV......
13:46:10.062324 IP 10.202.217.55.56284 > 192.168.240.1.80: tcp 0
E..@..@.@...
..7.......P.3.........................
BVdx........
13:46:11.064719 IP 10.202.217.55.56284 > 192.168.240.1.80: tcp 0
E..@2v@.@.s.
..7.......P.3.........................
BVh`........
13:46:11.925655 IP 192.168.7.1.80 > 10.202.217.55.56235: tcp 0
E..(->..........
..7.P..........P... ;........
13:46:12.065843 IP 10.202.217.55.56284 > 192.168.240.1.80: tcp 0
E..@..@.@...
..7.......P.3.........................
BVlH........
13:46:13.067191 IP 10.202.217.55.56284 > 192.168.240.1.80: tcp 0
E..@..@.@...
..7.......P.3.........................
BVp1........
13:46:14.068841 IP 10.202.217.55.56284 > 192.168.240.1.80: tcp 0
E..@.t@.@...
..7.......P.3.........................
BVt.........
13:46:15.070010 IP 10.202.217.55.56284 > 192.168.240.1.80: tcp 0
E..@.g@.@...
..7.......P.3.........................
BVx.........
13:46:17.128943 IP 10.202.217.55.56284 > 192.168.240.1.80: tcp 0
E..@.<@.@...
..7.......P.3...........I.............
BV..........
13:46:21.059871 IP 10.202.217.55.56284 > 192.168.240.1.80: tcp 0
E..4q.@.@.4C
..7.......P.3..........,......
BV......
13:46:24.596680 IP 10.202.217.55.56305 > 103.6.219.219.80: tcp 0
E..@.3@.@...
..7g......P.9q........................
BV..........
13:46:24.878748 IP 103.6.219.219.80 > 10.202.217.55.56305: tcp 0
E..4..@.2.!.g...
..7.P...B...9q.....................
13:46:24.878873 IP 10.202.217.55.56305 > 103.6.219.219.80: tcp 0
E..(..@.@.B.
..7g......P.9q..B..P. .
...
13:46:24.982938 IP 10.202.217.55.56305 > 103.6.219.219.80: tcp 258
E..*..@.@.hh
..7g......P.9q..B..P. .m...POST /pixel.gif HTTP/1.1
Connection: Close
Content-Length: 487
Cache-control: no-cache
Pragma: no-cache
Host: 103.6.219.219
Accept: */*
Accept-Encoding: identity
User-Agent: Mozilla/5.0 (Windows NT 6.1; WOW64; rv:27.0) Gecko/20100101 Firefox/27.0


13:46:25.211113 IP 103.6.219.219.80 > 10.202.217.55.56305: tcp 0
E..(....q...g...
..7.P...B...9r.P..m(5........
13:46:25.211234 IP 10.202.217.55.56305 > 103.6.219.219.80: tcp 487
E...c.@.@..E
..7g......P.9r..B..P. .............#.1.....N]\.Y^Lp.(..u...1...y.....qK..N..`...Xe.=L...7.......V...ye.Kk.%.aE
......'....\..c.z....	1.'...W.Q/..Y..J}.o..PP..-...].j..!....~..<B-U.....@.I."]i..Y...+....lim....qDM.|D.0...n1.....1..-..R..b..P.<`..M....f.Hi..........2.p._D.zR.S...4.e..PO.}.p.m.|..}.....2.*.	..`.... ...Y.3~....p3E.6.Z.K...M.........E.9.,."8s..)......W.......Z..{.7}...	...z'....&...42.......l.[(|u..sLR.hJI`.rT.....|N ...+U.@_...~...hh..Mv.. .G.mx$...!i.]......H4..K<..........\.J..=...S..y.:.{..`~
13:46:25.494237 IP 103.6.219.219.80 > 10.202.217.55.56305: tcp 0
E..(.a..q..g...
..7.P...B...9tlP...&7........
13:46:25.494240 IP 103.6.219.219.80 > 10.202.217.55.56305: tcp 362
E...Jp@.2...g...
..7.P...B...9tlP.......HTTP/1.1 200 OK
Server: nginx
Date: Tue, 29 Dec 2015 05:46:02 GMT
Content-Type: text/html
Transfer-Encoding: chunked
Connection: close
Cache-Control: no-cache
Cache-Control: max-age=0

9d
.........>(.,-.......*.r4.p...<	.u.l6.i....b3.&.......b.yj...X...M6m.e..\....Nj.....$&..
....tR...f.N....k?....k..&.+/.D...J....6M..1.V...7......6..]:..'.:.
0


13:46:25.494305 IP 10.202.217.55.56305 > 103.6.219.219.80: tcp 0
E..(T.@.@...
..7g......P.9tl.B.vP....]..
13:46:25.494580 IP 103.6.219.219.80 > 10.202.217.55.56305: tcp 0
E..(Jq@.2..{g...
..7.P...B.v.9tlP...$.........
13:46:25.494628 IP 10.202.217.55.56305 > 103.6.219.219.80: tcp 0
E..(.P@.@...
..7g......P.9tl.B.wP. ..P..
13:46:25.497681 IP 10.202.217.55.56305 > 103.6.219.219.80: tcp 0
E..(..@.@.~i
..7g......P.9tl.B.wP. ..O..
13:46:25.726575 IP 103.6.219.219.80 > 10.202.217.55.56305: tcp 1
E..)....q.	Ug...
..7.P...B.s.9tlP.......
.....
13:46:25.726623 IP 10.202.217.55.56305 > 103.6.219.219.80: tcp 0
E..(..@.@..S
..7g......P.9tl.B.wP. ..O..
13:46:25.742691 IP 103.6.219.219.80 > 10.202.217.55.56305: tcp 0
E..(....q.	Bg...
..7.P...B.w.9tmP...$.........
